{
  "version": "0.1",
  "layer": "second",
  "purpose": "Project-level tool adapter registry for the empirical paper workflow runtime.",
  "adapters": [
    {
      "id": "workflow_preflight",
      "category": "workflow_validation",
      "description": "Run deterministic second-layer workflow checks before runtime or product handoff.",
      "workflows": ["all"],
      "owner_agents": ["RouterAgent", "ArtifactAuditor"],
      "commands": ["python3 scripts/25_agent_runtime_preflight.py"],
      "inputs": ["workflows/registry.json", "workflows/agents/", "workflows/schemas/", "artifacts/workflow_runbook_state.json"],
      "outputs": ["artifacts/agent_runtime_preflight_report.md"],
      "network_required": false,
      "human_auth_required": false,
      "side_effect_level": "writes_reports",
      "allowed_in_orchestrator": true,
      "risks": ["Preflight can refresh report timestamps but must not change research estimates."],
      "verification": ["report status is PASS", "runtime runbook remains executable"],
      "trace_required": true
    },
    {
      "id": "workflow_runbook",
      "category": "workflow_state",
      "description": "Generate current workflow route, coverage, gates, failure codes, and JSON state.",
      "workflows": ["all"],
      "owner_agents": ["RouterAgent"],
      "commands": ["python3 scripts/23_workflow_runbook.py", "python3 scripts/24_validate_runbook_api.py"],
      "inputs": ["workflows/registry.json", "Tasks/artifact-registry.md"],
      "outputs": ["artifacts/workflow_runbook_report.md", "artifacts/workflow_runbook_state.json", "artifacts/workflow_api_validation_report.md"],
      "network_required": false,
      "human_auth_required": false,
      "side_effect_level": "writes_state",
      "allowed_in_orchestrator": true,
      "risks": ["State can be stale if artifact registry is stale."],
      "verification": ["runbook reports NEXT none or next workflow", "API validation PASS"],
      "trace_required": true
    },
    {
      "id": "literature_metadata_verifier",
      "category": "literature",
      "description": "Validate bibliography keys, citation coverage, and unused or incomplete references.",
      "workflows": ["02_literature", "08_format_citation"],
      "owner_agents": ["MetadataVerifier", "ReferenceVerifier"],
      "commands": ["python3 scripts/15_verify_bibliography.py"],
      "inputs": ["paper.tex", "references.bib"],
      "outputs": ["verified_bibliography.csv", "artifacts/bibliography_verification_report.md"],
      "network_required": false,
      "human_auth_required": false,
      "side_effect_level": "writes_reports",
      "allowed_in_orchestrator": true,
      "risks": ["Metadata completeness is structural; DOI truth still needs source checks when disputed."],
      "verification": ["fail count is 0", "unused references are 0 or justified"],
      "trace_required": true
    },
    {
      "id": "pdf_fetch_scansci",
      "category": "literature_fetch",
      "description": "Fetch legally available PDFs or institutional-access PDFs when the user is authenticated.",
      "workflows": ["02_literature", "03_paper_reading"],
      "owner_agents": ["PDFFetchAgent"],
      "commands": ["scansci-pdf run"],
      "inputs": ["DOI", "BibTeX", "institution access when authorized"],
      "outputs": ["lit_pdfs/", "references.bib candidate entries"],
      "network_required": true,
      "human_auth_required": true,
      "side_effect_level": "external_download",
      "allowed_in_orchestrator": false,
      "risks": ["Requires legal access boundary; cannot store cookies or VPN sessions."],
      "verification": ["downloaded file exists", "failure reason recorded", "legal access mode documented"],
      "trace_required": true
    },
    {
      "id": "cnki_browser_hqu",
      "category": "literature_fetch",
      "description": "Use the user's already-authenticated HQU VPN browser session for CNKI retrieval.",
      "workflows": ["02_literature", "03_paper_reading"],
      "owner_agents": ["PDFFetchAgent", "PaperReadingAgent"],
      "commands": ["Chrome user session"],
      "inputs": ["user-authenticated HQU VPN", "CNKI page URL", "paper title"],
      "outputs": ["lit_pdfs/cnki_vpn_test/", "parsed text when available"],
      "network_required": true,
      "human_auth_required": true,
      "side_effect_level": "browser_download",
      "allowed_in_orchestrator": false,
      "risks": ["Credential-gated; must not persist session secrets; must record source and access boundary."],
      "verification": ["PDF exists", "pdftotext or parser can read file", "source URL or title recorded"],
      "trace_required": true
    },
    {
      "id": "data_gate_runner",
      "category": "data",
      "description": "Audit analysis-ready data, variables, attrition, and panel structure.",
      "workflows": ["04_data_gate"],
      "owner_agents": ["DataPreparationAgent", "DataGateAuditor"],
      "commands": ["python3 scripts/04_data_gate.py"],
      "inputs": ["artifacts/did_sample.pkl", "research_design.md", "causal_question.yaml"],
      "outputs": ["artifacts/data_contract.md", "artifacts/data_gate_report.md", "artifacts/sample_attrition.csv", "artifacts/variable_dictionary.csv", "artifacts/panel_audit.csv"],
      "network_required": false,
      "human_auth_required": false,
      "side_effect_level": "writes_reports",
      "allowed_in_orchestrator": true,
      "risks": ["Cannot judge whether variable proxies are academically acceptable."],
      "verification": ["data gate report exists", "variable dictionary exists", "panel audit exists"],
      "trace_required": true
    },
    {
      "id": "causal_analysis_runner",
      "category": "statistics",
      "description": "Run core DID, robustness, supplemental figures, tables, and revision robustness checks.",
      "workflows": ["05_causal_analysis", "07_revision"],
      "owner_agents": ["CausalAnalysisAgent", "IdentificationAuditor", "RobustnessAuditor"],
      "commands": [
        "python3 scripts/05_event_study.py",
        "python3 scripts/06_table2.py",
        "python3 scripts/08_robustness.py",
        "python3 scripts/09_supplemental.py",
        "python3 scripts/10_aer_regtable.py",
        "python3 scripts/13_revision_robustness.py"
      ],
      "inputs": ["artifacts/did_sample.pkl", "causal_question.yaml", "model_log.md"],
      "outputs": ["tables/", "figures/", "paper_tables/", "artifacts/analysis_rerun_report.md", "artifacts/revision_robustness_report.md"],
      "network_required": false,
      "human_auth_required": false,
      "side_effect_level": "rewrites_results",
      "allowed_in_orchestrator": false,
      "risks": ["Can change tables and figures; must be followed by project-specific reproducibility checks."],
      "verification": ["model report updated", "table and figure files exist", "claim language remains aligned"],
      "trace_required": true
    },
    {
      "id": "latex_compile",
      "category": "document_build",
      "description": "Compile the paper and bibliography into a readable PDF.",
      "workflows": ["06_writing", "07_revision", "08_format_citation"],
      "owner_agents": ["WritingAgent", "LayoutAgent"],
      "commands": ["xelatex -interaction=nonstopmode paper.tex", "bibtex paper", "xelatex -interaction=nonstopmode paper.tex", "xelatex -interaction=nonstopmode paper.tex"],
      "inputs": ["paper.tex", "references.bib", "paper_tables/", "figures/"],
      "outputs": ["paper.pdf", "paper.log"],
      "network_required": false,
      "human_auth_required": false,
      "side_effect_level": "build_artifacts",
      "allowed_in_orchestrator": true,
      "risks": ["Warnings may be hidden unless paper.log is inspected."],
      "verification": ["paper.pdf exists", "no undefined citation/reference", "no overfull table warnings for final pass"],
      "trace_required": true
    },
    {
      "id": "reproduction_verify",
      "category": "replication",
      "description": "Run a template-safe runtime reproducibility smoke check.",
      "workflows": ["09_replication"],
      "owner_agents": ["ReproAgent", "ArtifactAuditor"],
      "commands": ["python3 scripts/23_workflow_runbook.py"],
      "inputs": ["workflows/registry.json", "workflows/agents/"],
      "outputs": ["artifacts/workflow_runbook_report.md", "artifacts/workflow_runbook_state.json"],
      "network_required": false,
      "human_auth_required": false,
      "side_effect_level": "read_only",
      "allowed_in_orchestrator": true,
      "risks": ["This only verifies runtime wiring; paper-specific reproducibility must be added per project."],
      "verification": ["workflow runbook command exits 0"],
      "trace_required": true
    },
    {
      "id": "browser_preview",
      "category": "human_review",
      "description": "Open generated reports or PDFs in Chrome for user-facing inspection.",
      "workflows": ["all"],
      "owner_agents": ["LeadAgent"],
      "commands": ["open -a 'Google Chrome' <path>"],
      "inputs": ["paper.pdf", "artifacts/*_report.md", "tasks/*.md"],
      "outputs": ["Chrome window/tab"],
      "network_required": false,
      "human_auth_required": false,
      "side_effect_level": "local_preview",
      "allowed_in_orchestrator": true,
      "risks": ["Opening the wrong artifact can mislead manual review."],
      "verification": ["requested artifact path opened after generation"],
      "trace_required": true
    },
    {
      "id": "policy_rollout_builder",
      "category": "policy_data",
      "description": "Build the seed policy rollout layer for future province-level ATT upgrades.",
      "workflows": ["05x_policy_rollout_data_layer"],
      "owner_agents": ["PolicyDataAgent", "MergeAuditor"],
      "commands": ["python3 scripts/16_build_policy_rollout.py"],
      "inputs": ["data/policy/urbmi_ncms_rollout_sources.csv"],
      "outputs": ["data/policy/policy_rollout_clean.csv", "artifacts/policy_rollout_merge_report.md"],